{
  "version": "1",
  "generated_at": "2026-10-12T06:00:00.000Z",
  "user": {
    "locale": "sw",
    "week_start": "monday",
    "display_name": "Wanjiru"
  },
  "period": {
    "kind": "month",
    "start": "2026-09-01T00:00:00+03:00",
    "end": "2026-10-01T00:00:00+03:00",
    "label_en": "September 2026",
    "label_sw": "Septemba 2026",
    "days": 30,
    "days_elapsed": 30,
    "timezone": "Africa/Nairobi"
  },
  "previous_period": {
    "kind": "month",
    "start": "2026-08-01T00:00:00+03:00",
    "end": "2026-09-01T00:00:00+03:00",
    "label_en": "August 2026",
    "label_sw": "Agosti 2026",
    "days": 31,
    "days_elapsed": 31,
    "timezone": "Africa/Nairobi"
  },
  "totals": {
    "in": {
      "cents": 8650000,
      "display": "KSh 86,500"
    },
    "out": {
      "cents": 6289000,
      "display": "KSh 62,890"
    },
    "fees": {
      "cents": 41899,
      "display": "KSh 419"
    },
    "net": {
      "cents": 2319101,
      "display": "KSh 23,191"
    },
    "transfers": {
      "cents": 7000000,
      "display": "KSh 70,000"
    },
    "cash_withdrawn": {
      "cents": 850000,
      "display": "KSh 8,500"
    },
    "savings_out": {
      "cents": 500000,
      "display": "KSh 5,000"
    },
    "loan_repayments": {
      "cents": 161499,
      "display": "KSh 1,615"
    },
    "transaction_count": {
      "value": 45,
      "display": "45"
    },
    "fee_ratio": {
      "value": 1,
      "display": "1%"
    },
    "savings_rate": {
      "value": 6,
      "display": "6%"
    }
  },
  "previous_totals": {
    "in": {
      "cents": 8500000,
      "display": "KSh 85,000"
    },
    "out": {
      "cents": 2413500,
      "display": "KSh 24,135"
    },
    "fees": {
      "cents": 19100,
      "display": "KSh 191"
    },
    "net": {
      "cents": 6067400,
      "display": "KSh 60,674"
    },
    "transfers": {
      "cents": 5500000,
      "display": "KSh 55,000"
    },
    "cash_withdrawn": {
      "cents": 350000,
      "display": "KSh 3,500"
    },
    "savings_out": {
      "cents": 500000,
      "display": "KSh 5,000"
    },
    "loan_repayments": {
      "cents": 0,
      "display": "KSh 0"
    },
    "transaction_count": {
      "value": 23,
      "display": "23"
    },
    "fee_ratio": {
      "value": 1,
      "display": "1%"
    },
    "savings_rate": {
      "value": 6,
      "display": "6%"
    }
  },
  "deltas": {
    "out": {
      "cents": 3875500,
      "display": "KSh +38,755",
      "pct": {
        "value": 161,
        "display": "161%"
      },
      "direction": "up"
    },
    "in": {
      "cents": 150000,
      "display": "KSh +1,500",
      "pct": {
        "value": 2,
        "display": "2%"
      },
      "direction": "up"
    },
    "fees": {
      "cents": 22799,
      "display": "KSh +228",
      "pct": {
        "value": 119,
        "display": "119%"
      },
      "direction": "up"
    },
    "net": {
      "cents": -3748299,
      "display": "KSh -37,483",
      "pct": {
        "value": -62,
        "display": "-62%"
      },
      "direction": "down"
    }
  },
  "categories": [
    {
      "category_id": "food_groceries.supermarket",
      "name_en": "Supermarket",
      "name_sw": "Supamaketi",
      "out": {
        "cents": 2518000,
        "display": "KSh 25,180"
      },
      "share": {
        "value": 40,
        "display": "40%"
      },
      "delta": {
        "cents": 1200000,
        "display": "KSh +12,000",
        "pct": {
          "value": 91,
          "display": "91%"
        },
        "direction": "up"
      },
      "count": {
        "value": 12,
        "display": "12"
      },
      "top_merchant": "NAIVAS LTD KILIMANI",
      "drilldown": {
        "kind": "transactions",
        "filter": {
          "from": "2026-09-01T00:00:00+03:00",
          "to": "2026-10-01T00:00:00+03:00",
          "category_id": "food_groceries.supermarket",
          "direction": "out"
        }
      }
    },
    {
      "category_id": "housing_rent.rent",
      "name_en": "Rent",
      "name_sw": "Kodi ya nyumba",
      "out": {
        "cents": 1800000,
        "display": "KSh 18,000"
      },
      "share": {
        "value": 29,
        "display": "29%"
      },
      "delta": {
        "cents": 1800000,
        "display": "KSh +18,000",
        "pct": {
          "value": 0,
          "display": "0%"
        },
        "direction": "na"
      },
      "count": {
        "value": 1,
        "display": "1"
      },
      "top_merchant": "MAKAO PROPERTIES",
      "drilldown": {
        "kind": "transactions",
        "filter": {
          "from": "2026-09-01T00:00:00+03:00",
          "to": "2026-10-01T00:00:00+03:00",
          "category_id": "housing_rent.rent",
          "direction": "out"
        }
      }
    },
    {
      "category_id": "cash_withdrawals.agent",
      "name_en": "Agent withdrawal",
      "name_sw": "Kutoa kwa wakala",
      "out": {
        "cents": 850000,
        "display": "KSh 8,500"
      },
      "share": {
        "value": 14,
        "display": "14%"
      },
      "delta": {
        "cents": 500000,
        "display": "KSh +5,000",
        "pct": {
          "value": 143,
          "display": "143%"
        },
        "direction": "up"
      },
      "count": {
        "value": 5,
        "display": "5"
      },
      "top_merchant": "KASARANI AGENCIES LTD",
      "drilldown": {
        "kind": "transactions",
        "filter": {
          "from": "2026-09-01T00:00:00+03:00",
          "to": "2026-10-01T00:00:00+03:00",
          "category_id": "cash_withdrawals.agent",
          "direction": "out"
        }
      }
    },
    {
      "category_id": "transport.ride_hailing",
      "name_en": "Ride-hailing",
      "name_sw": "Teksi ya app",
      "out": {
        "cents": 309000,
        "display": "KSh 3,090"
      },
      "share": {
        "value": 5,
        "display": "5%"
      },
      "delta": {
        "cents": 175500,
        "display": "KSh +1,755",
        "pct": {
          "value": 131,
          "display": "131%"
        },
        "direction": "up"
      },
      "count": {
        "value": 4,
        "display": "4"
      },
      "top_merchant": "UBER KENYA",
      "drilldown": {
        "kind": "transactions",
        "filter": {
          "from": "2026-09-01T00:00:00+03:00",
          "to": "2026-10-01T00:00:00+03:00",
          "category_id": "transport.ride_hailing",
          "direction": "out"
        }
      }
    },
    {
      "category_id": "utilities.electricity",
      "name_en": "Electricity (KPLC tokens & bills)",
      "name_sw": "Stima (tokeni na bili za KPLC)",
      "out": {
        "cents": 300000,
        "display": "KSh 3,000"
      },
      "share": {
        "value": 5,
        "display": "5%"
      },
      "delta": {
        "cents": 150000,
        "display": "KSh +1,500",
        "pct": {
          "value": 100,
          "display": "100%"
        },
        "direction": "up"
      },
      "count": {
        "value": 2,
        "display": "2"
      },
      "top_merchant": "KPLC PREPAID",
      "drilldown": {
        "kind": "transactions",
        "filter": {
          "from": "2026-09-01T00:00:00+03:00",
          "to": "2026-10-01T00:00:00+03:00",
          "category_id": "utilities.electricity",
          "direction": "out"
        }
      }
    },
    {
      "category_id": "family_friends.sent_to_people",
      "name_en": "Sent to people",
      "name_sw": "Pesa ulizotuma kwa watu",
      "out": {
        "cents": 300000,
        "display": "KSh 3,000"
      },
      "share": {
        "value": 5,
        "display": "5%"
      },
      "delta": {
        "cents": 0,
        "display": "KSh 0",
        "pct": {
          "value": 0,
          "display": "0%"
        },
        "direction": "flat"
      },
      "count": {
        "value": 1,
        "display": "1"
      },
      "top_merchant": null,
      "drilldown": {
        "kind": "transactions",
        "filter": {
          "from": "2026-09-01T00:00:00+03:00",
          "to": "2026-10-01T00:00:00+03:00",
          "category_id": "family_friends.sent_to_people",
          "direction": "out"
        }
      }
    },
    {
      "category_id": "subscriptions_entertainment.streaming",
      "name_en": "Streaming",
      "name_sw": "Kutazama mtandaoni",
      "out": {
        "cents": 110000,
        "display": "KSh 1,100"
      },
      "share": {
        "value": 2,
        "display": "2%"
      },
      "delta": {
        "cents": 0,
        "display": "KSh 0",
        "pct": {
          "value": 0,
          "display": "0%"
        },
        "direction": "flat"
      },
      "count": {
        "value": 1,
        "display": "1"
      },
      "top_merchant": "NETFLIX",
      "drilldown": {
        "kind": "transactions",
        "filter": {
          "from": "2026-09-01T00:00:00+03:00",
          "to": "2026-10-01T00:00:00+03:00",
          "category_id": "subscriptions_entertainment.streaming",
          "direction": "out"
        }
      }
    },
    {
      "category_id": "airtime_bundles",
      "name_en": "Airtime & bundles",
      "name_sw": "Airtime na bando",
      "out": {
        "cents": 90000,
        "display": "KSh 900"
      },
      "share": {
        "value": 1,
        "display": "1%"
      },
      "delta": {
        "cents": 50000,
        "display": "KSh +500",
        "pct": {
          "value": 125,
          "display": "125%"
        },
        "direction": "up"
      },
      "count": {
        "value": 9,
        "display": "9"
      },
      "top_merchant": "Safaricom",
      "drilldown": {
        "kind": "transactions",
        "filter": {
          "from": "2026-09-01T00:00:00+03:00",
          "to": "2026-10-01T00:00:00+03:00",
          "category_id": "airtime_bundles",
          "direction": "out"
        }
      }
    },
    {
      "category_id": "fees",
      "name_en": "fees",
      "name_sw": "fees",
      "out": {
        "cents": 12000,